{
  "schema": "rsscript.execution_report.v1",
  "artifact_digest": "sha256:aaaaaaaaaaaaaaaaaaaaaaaaaaaaaaaaaaaaaaaaaaaaaaaaaaaaaaaaaaaaaaaa",
  "termination_reason": "completed",
  "usage": {
    "steps_consumed": 12,
    "allocation_bytes_consumed": 0,
    "output_bytes": 0,
    "intrinsic_calls": 0,
    "provider_calls": 0,
    "resources_created": 0,
    "resources_cleaned": 0,
    "resource_cleanup_failures": 0,
    "resources_live_at_return": 0
  },
  "value": "Unit",
  "display_value": "Unit",
  "native_value": "Unit",
  "stdout": "",
  "stderr": "",
  "provider_call_traces": [],
  "diagnostics": [],
  "failure": null
}
